URL,Content
https://edition.cnn.com/2023/12/08/economy/november-jobs-report-final/index.html,"Markets Fear & Greed Index Latest Market News The US economy notched another solid month of job growth, with an added lift from actors and autoworkers coming off the picket lines. Employers added 199,000 jobs in November, and the unemployment rate dipped to 3.7% from 3.9% the month before, according to Bureau of Labor Statistics data released Friday. “The economy’s still humming along,” Jane Oates, a former Department of Labor official who now is CEO of employment education nonprofit WorkingNation, told CNN. “For the past two weeks, all we’ve heard is doom and gloom about how this is going to be a terrible day. And it was a much better day than was predicted.” Economists were expecting net job gains of 180,000 for the month and for the unemployment rate to hold steady, according to Refinitiv. The labor force participation rate ticked up 0.1 percentage points to 62.8%, returning to its highest level since the onset of the pandemic. The participation rate increase is a “positive underlying context to the unemployment rate decline,” wrote Daniel Zhao, Glassdoor’s lead economist, in commentary issued Friday. The largest employment gains last month came in health care and government, which added an estimated 93,200 and 49,000 jobs, respectively. Manufacturing saw a boost, too, largely because of thereturn of striking autoworkers, which lifted motor vehicles and parts employment by 30,000 jobs. Additionally, the resolution of the Screen Actors Guild strike against Hollywood studios resulted in 17,200 jobs added in the motion picture and sound recording industries. In total, the BLS was anticipating a net gain of 35,000 workers returning after strikes: Theagency estimatedthat 61,000 workers were absent from the labor market due to labor disputes, versus 96,000 the month before. Taking into account those one-time gains, the underlying rate of job growth is likely around 160,000 jobs per month, which aligns with the 2019 average, wrote Julia Pollak, senior economist with ZipRecruiter. November’s jobs number is in line with the strong monthly gains hit in the decade before the pandemic, when 183,000 jobs per month were added. The current rate of job growth also is well above the “neutral rate,” or what’s needed to keep up with population growth. “It is critical to put this data in the proper context,” Joseph Brusuelas, principal and chief economist of RSM US, wrote in a note on Friday. “Given long-term demographic changes and structural transformation of the US economy to keep employment stable, only 75,000 jobs per month need to be created, in contrast with the roughly 200,000 that was the case just over a decade ago.” The biggest declines occurred in the retail trade and temporary help services sectors, which lost 38,400 jobs and 13,600 jobs, respectively. “The [reason for the] reduction of jobs in retail is very similar to the reduction of jobs in other places, except retail hasn’t been able to absorb — and that’s technology,” Oates said. As e-commerce and in-store pick-ups become more engrained in how people shop, that leads to fewer people needed at the brick-and-mortar level. November’s job growth was stronger thanOctober’s unrevised tally of 150,000 jobs added. September’s job gains were revised down to 262,000 from 297,000, according to the BLS. The continued strength in the labor market has helped fuel consumer spending and economic growth, but Federal Reserve officials believe slower demand (and slower wage growth) will help bring down inflation. Friday’s jobs report showed that average hourly earnings rose 0.4% in November from the month before, showing a more accelerated pace of growth than the 0.2% uptick seen in October and the 0.3% expected by economists. Fed Chair Powell: Too early to say when to expect rate cuts On an annual basis, however, wage gains eased to 4% from the 4.1% rate seen a month before. Through November, the economy has added an average of 232,000 jobs per month — far more moderate growth than 2022 and 2021, when an estimated 399,000 and 606,000 jobs were added every month, respectively. Friday’s strong jobs report likely keeps the Fed’s options open, although cooling inflation should mean that another pause is in store when the central bank meets next week, wrote Lydia Boussour, EY senior economist. “Labor market endurance will lead Fed officials to retain some optionality for future rate hikes, if needed,” she wrote. “We expect policymakers will resist talking about rate cuts until early 2024.” Most stock quote data provided by BATS. US market indices are shown in real time, except for the S&P 500 which is refreshed every two minutes. All times are ET. Factset: FactSet Research Systems Inc. All rights reserved. Chicago Mercantile: Certain market data is the property of Chicago Mercantile Exchange Inc. and its licensors. All rights reserved. Dow Jones: The Dow Jones branded indices are proprietary to and are calculated, distributed and marketed by DJI Opco, a subsidiary of S&P Dow Jones Indices LLC and have been licensed for use to S&P Opco, LLC and CNN. Standard & Poor’s and S&P are registered trademarks of Standard & Poor’s Financial Services LLC and Dow Jones is a registered trademark of Dow Jones Trademark Holdings LLC. All content of the Dow Jones branded indices Copyright S&P Dow Jones Indices LLC and/or its affiliates. Fair value provided by IndexArb.com. Market holidays and trading hours provided by Copp Clark Limited. © 2023 Cable News Network. A Warner Bros. Discovery Company. All Rights Reserved.CNN Sans ™ & © 2016 Cable News Network."
https://www.cnbc.com/2023/12/08/jobs-report-november-2023-us-payrolls-rose-199000-in-november-unemployment-rate-falls-to-3point7percent.html,"Credit Cards Loans Banking Mortgages Insurance Credit Monitoring Personal Finance Small Business Taxes Help for Low Credit Scores Investing SELECT AllCredit Cards Find the Credit Card for You Best Credit Cards Best Rewards Credit Cards Best Travel Credit Cards Best 0% APR Credit Cards Best Balance Transfer Credit Cards Best Cash Back Credit Cards Best Credit Card Welcome Bonuses Best Credit Cards to Build Credit SELECT AllLoans Find the Best Personal Loan for You Best Personal Loans Best Debt Consolidation Loans Best Loans to Refinance Credit Card Debt Best Loans with Fast Funding Best Small Personal Loans Best Large Personal Loans Best Personal Loans to Apply Online Best Student Loan Refinance SELECT AllBanking Find the Savings Account for You Best High Yield Savings Accounts Best Big Bank Savings Accounts Best Big Bank Checking Accounts Best No Fee Checking Accounts No Overdraft Fee Checking Accounts Best Checking Account Bonuses Best Money Market Accounts Best CDs Best Credit Unions SELECT AllMortgages Best Mortgages Best Mortgages for Small Down Payment Best Mortgages for No Down Payment Best Mortgages with No Origination Fee Best Mortgages for Average Credit Score Adjustable Rate Mortgages Affording a Mortgage SELECT AllInsurance Best Life Insurance Best Homeowners Insurance Best Renters Insurance Best Car Insurance Travel Insurance SELECT AllCredit Monitoring Best Credit Monitoring Services Best Identity Theft Protection How to Boost Your Credit Score Credit Repair Services SELECT AllPersonal Finance Best Budgeting Apps Best Expense Tracker Apps Best Money Transfer Apps Best Resale Apps and Sites Buy Now Pay Later (BNPL) Apps Best Debt Relief SELECT AllSmall Business Best Small Business Savings Accounts Best Small Business Checking Accounts Best Credit Cards for Small Business Best Small Business Loans Best Tax Software for Small Business SELECT AllTaxes Best Tax Software Best Tax Software for Small Businesses Tax Refunds SELECT AllHelp for Low Credit Scores Best Credit Cards for Bad Credit Best Personal Loans for Bad Credit Best Debt Consolidation Loans for Bad Credit Personal Loans if You Don't Have Credit Best Credit Cards for Building Credit Personal Loans for 580 Credit Score or Lower Personal Loans for 670 Credit Score or Lower Best Mortgages for Bad Credit Best Hardship Loans How to Boost Your Credit Score SELECT AllInvesting Best IRA Accounts Best Roth IRA Accounts Best Investing Apps Best Free Stock Trading Platforms Best Robo-Advisors Index Funds Mutual Funds ETFs Bonds  Job creation showed little signs of a letup in November, as payrolls grew even faster than expected and the unemployment rate fell despite signs of a weakening economy. Nonfarm payrolls rose by a seasonally adjusted 199,000 for the month, slightly better than the 190,000 Dow Jones estimate and ahead of the unrevised October gain of 150,000, the Labor Department reported Friday. The numbers were boosted by sizeable gains in government hiring as well as workers returning from strikes in the auto and entertainment industries. The unemployment rate declined to 3.7%, compared with the forecast for 3.9%, as the labor force participation rate edged higher to 62.8%. A more encompassing unemployment rate that includes discouraged workers and those holding part-time positions for economic reasons fell to 7%, a decline of 0.2 percentage point. ""The job market continues to be resilient after a year of dodging recession fears,"" said Daniel Zhao, lead economist at job ratings site Glassdoor. ""Really the one concern that we had coming in today's report was the recent rise in the unemployment rate. So the improvement in unemployment was a welcome relief."" The department's survey of households, used to calculate the unemployment rate, showed much more robust job growth of 747,000 and an addition of 532,000 workers to the labor force. Average hourly earnings, a key inflation indicator, increased by 0.4% for the month and 4% from a year ago. The monthly increase was slightly ahead of the 0.3% estimate, but the yearly rate was in line. Markets showed mixed reaction to the report, with stock market futures modestly negative while Treasury yields surged. ""What we wanted was a strong but moderating labor market, and that's what we saw in the November report,"" said Robert Frick, corporate economist with Navy Federal Credit Union, noting ""healthy job growth, lower unemployment, and decent wage increases. All this points to the labor market reaching a natural equilibrium around 150,000 jobs [per month] next year, which is plenty to continue the expansion, and not enough to trigger a Fed rate hike."" Health care was the biggest growth industry, adding 77,000 jobs. Other big gainers included government (49,000), manufacturing (28,000), and leisure and hospitality (40,000). Heading into the holiday season, retail lost 38,000 jobs, half of which came from department stores. Transportation and warehousing also showed a decline of 5,000. Duration of unemployment fell sharply, dropping to an average 19.4 weeks, the lowest level since February. The report comes at a critical time for the U.S. economy. Though growth defied widespread expectations for a recession this year, most economists expect a sharp slowdown in the fourth quarter and tepid gains in 2024. Gross domestic product is on pace to rise at just a 1.2% annualized pace in the fourth quarter, according to an Atlanta Fed data gauge, and most economists expect growth of around 1% in 2024. Federal Reserve officials are watching the jobs numbers closely as they continue to try to bring down inflation that had been running at a four-decade high but has shown signs of easing. Futures markets pricing strongly points to the Fed halting its rate-hiking campaign and beginning to cut next year, though central bank officials have been more circumspect about what lies ahead. Pricing had been pointing to the first reduction happening in March, though that swung following the jobs report, pushing a higher probability for the first expected cut now to May. The Fed will hold its two-day policy meeting next week, its last of the year, and investors will be looking for clues about how officials view the economy. Policymakers have been aiming to bring the economy in for a soft landing that likely would feature modest growth, a sustainable pace of wage increases and inflation at least receding back to the Fed's 2% target. Consumers hold the key to the U.S. economy, and by most measures they've held up fairly well. Retail sales fell 0.1% in October but were still up 2.5% from the previous year. The numbers are not adjusted for inflation, so they indicate that consumers at least have nearly kept pace with higher prices. A gauge the Fed uses showed inflation running at a 3.5% annual rate in October, excluding food and energy prices. However, there is some worry that the end of Covid-era stimulus payments and the continued pressure from higher interest rates could eat into spending. Net household wealth fell by about $1.3 trillion in the third quarter to about $151 trillion, owing largely to declines in the stock market, according to Fed data released this week. Household debt rose 2.5%, close to the pace where it has been for the past several quarters. Fed officials have been watching wage data closely. Rising prices tend to feed into wages, potentially creating a spiral that can be difficult to control. Don't miss these stories from CNBC PRO: Got a confidential news tip? We want to hear from you. Sign up for free newsletters and get more CNBC delivered to your inbox Get this delivered to your inbox, and more info about our products and services. ©2023CNBC LLC. All Rights Reserved.A Division of NBCUniversal Data is a real-time snapshot *Data is delayed at least 15 minutes. Global Business and Financial News, Stock Quotes, and Market Data and Analysis. Data also provided by"
https://www.wishtv.com/news/national/the-us-economy-added-199000-jobs-in-november/,"Minneapolis (CNN) —The US economy notched another solid month of job growth, with an added lift from actors and autoworkers coming off the picket lines.Employers added 199,000 jobs in November, and the unemployment rate dipped to 3.7% from 3.9% the month before, according to Bureau of Labor Statistics data released Friday.“The economy’s still humming along,” Jane Oates, a former Department of Labor official who now is CEO of employment education nonprofit WorkingNation, told CNN. “For the past two weeks, all we’ve heard is doom and gloom about how this is going to be a terrible day. And it was a much better day than was predicted.”Economists were expecting net job gains of 180,000 for the month and for the unemployment rate to hold steady, according to Refinitiv.The labor force participation rate ticked up 0.1 percentage points to 62.8%, returning to its highest level since the onset of the pandemic. The participation rate increase is a “positive underlying context to the unemployment rate decline,” wrote Daniel Zhao, Glassdoor’s lead economist, in commentary issued Friday.One-time boostsThe largest employment gains last month came in health care and government, which added an estimated 93,200 and 49,000 jobs, respectively. Manufacturing saw a boost, too, largely because of thereturn of striking autoworkers, which lifted motor vehicles and parts employment by 30,000 jobs.Additionally, the resolution of the Screen Actors Guild strike against Hollywood studios resulted in 17,200 jobs added in the motion picture and sound recording industries.In total, the BLS was anticipating a net gain of 35,000 workers returning after strikes: Theagency estimatedthat 61,000 workers were absent from the labor market due to labor disputes, versus 96,000 the month before.Taking into account those one-time gains, the underlying rate of job growth is likely around 160,000 jobs per month, which aligns with the 2019 average, wrote Julia Pollak, senior economist with ZipRecruiter.November’s jobs number is in line with the strong monthly gains hit in the decade before the pandemic, when 183,000 jobs per month were added. The current rate of job growth also is well above the “neutral rate,” or what’s needed to keep up with population growth.“It is critical to put this data in the proper context,” Joseph Brusuelas, principal and chief economist of RSM US, wrote in a note on Friday. “Given long-term demographic changes and structural transformation of the US economy to keep employment stable, only 75,000 jobs per month need to be created, in contrast with the roughly 200,000 that was the case just over a decade ago.”Retail drop-offThe biggest declines occurred in the retail trade and temporary help services sectors, which lost 38,400 jobs and 13,600 jobs, respectively.“The [reason for the] reduction of jobs in retail is very similar to the reduction of jobs in other places, except retail hasn’t been able to absorb — and that’s technology,” Oates said.As e-commerce and in-store pick-ups become more engrained in how people shop, that leads to fewer people needed at the brick-and-mortar level.What this means for the FedNovember’s job growth was stronger thanOctober’s unrevised tally of 150,000 jobs added. September’s job gains were revised down to 262,000 from 297,000, according to the BLS.The continued strength in the labor market has helped fuel consumer spending and economic growth, but Federal Reserve officials believe slower demand (and slower wage growth) will help bring down inflation.Friday’s jobs report showed that average hourly earnings rose 0.4% in November from the month before, showing a more accelerated pace of growth than the 0.2% uptick seen in October and the 0.3% expected by economists.On an annual basis, however, wage gains eased to 4% from the 4.1% rate seen a month before.Through November, the economy has added an average of 232,000 jobs per month — far more moderate growth than 2022 and 2021, when an estimated 399,000 and 606,000 jobs were added every month, respectively.Friday’s strong jobs report likely keeps the Fed’s options open, although cooling inflation should mean that another pause is in store when the central bank meets next week, wrote Lydia Boussour, EY senior economist.“Labor market endurance will lead Fed officials to retain some optionality for future rate hikes, if needed,” she wrote. “We expect policymakers will resist talking about rate cuts until early 2024.” Minneapolis (CNN) —The US economy notched another solid month of job growth, with an added lift from actors and autoworkers coming off the picket lines. Employers added 199,000 jobs in November, and the unemployment rate dipped to 3.7% from 3.9% the month before, according to Bureau of Labor Statistics data released Friday. “The economy’s still humming along,” Jane Oates, a former Department of Labor official who now is CEO of employment education nonprofit WorkingNation, told CNN. “For the past two weeks, all we’ve heard is doom and gloom about how this is going to be a terrible day. And it was a much better day than was predicted.” Economists were expecting net job gains of 180,000 for the month and for the unemployment rate to hold steady, according to Refinitiv. The labor force participation rate ticked up 0.1 percentage points to 62.8%, returning to its highest level since the onset of the pandemic. The participation rate increase is a “positive underlying context to the unemployment rate decline,” wrote Daniel Zhao, Glassdoor’s lead economist, in commentary issued Friday. The largest employment gains last month came in health care and government, which added an estimated 93,200 and 49,000 jobs, respectively. Manufacturing saw a boost, too, largely because of thereturn of striking autoworkers, which lifted motor vehicles and parts employment by 30,000 jobs. Additionally, the resolution of the Screen Actors Guild strike against Hollywood studios resulted in 17,200 jobs added in the motion picture and sound recording industries. In total, the BLS was anticipating a net gain of 35,000 workers returning after strikes: Theagency estimatedthat 61,000 workers were absent from the labor market due to labor disputes, versus 96,000 the month before. Taking into account those one-time gains, the underlying rate of job growth is likely around 160,000 jobs per month, which aligns with the 2019 average, wrote Julia Pollak, senior economist with ZipRecruiter. November’s jobs number is in line with the strong monthly gains hit in the decade before the pandemic, when 183,000 jobs per month were added. The current rate of job growth also is well above the “neutral rate,” or what’s needed to keep up with population growth. “It is critical to put this data in the proper context,” Joseph Brusuelas, principal and chief economist of RSM US, wrote in a note on Friday. “Given long-term demographic changes and structural transformation of the US economy to keep employment stable, only 75,000 jobs per month need to be created, in contrast with the roughly 200,000 that was the case just over a decade ago.” The biggest declines occurred in the retail trade and temporary help services sectors, which lost 38,400 jobs and 13,600 jobs, respectively. “The [reason for the] reduction of jobs in retail is very similar to the reduction of jobs in other places, except retail hasn’t been able to absorb — and that’s technology,” Oates said. As e-commerce and in-store pick-ups become more engrained in how people shop, that leads to fewer people needed at the brick-and-mortar level. November’s job growth was stronger thanOctober’s unrevised tally of 150,000 jobs added. September’s job gains were revised down to 262,000 from 297,000, according to the BLS. The continued strength in the labor market has helped fuel consumer spending and economic growth, but Federal Reserve officials believe slower demand (and slower wage growth) will help bring down inflation. Friday’s jobs report showed that average hourly earnings rose 0.4% in November from the month before, showing a more accelerated pace of growth than the 0.2% uptick seen in October and the 0.3% expected by economists. On an annual basis, however, wage gains eased to 4% from the 4.1% rate seen a month before. Through November, the economy has added an average of 232,000 jobs per month — far more moderate growth than 2022 and 2021, when an estimated 399,000 and 606,000 jobs were added every month, respectively. Friday’s strong jobs report likely keeps the Fed’s options open, although cooling inflation should mean that another pause is in store when the central bank meets next week, wrote Lydia Boussour, EY senior economist. “Labor market endurance will lead Fed officials to retain some optionality for future rate hikes, if needed,” she wrote. “We expect policymakers will resist talking about rate cuts until early 2024.”"
